{
  "schemaVersion": "practice-topik35-listening-audio-qa-v1",
  "packageId": "topik35-v1-listening-audio-qa-v1",
  "bundleId": "topik35-v1",
  "verifiedAt": "2026-08-03T14:33:15Z",
  "status": "SOURCE_IDENTITY_AND_AUDIO_DERIVATION_VERIFIED_BOUNDARY_QA_BLOCKED",
  "sourceIdentity": {
    "sourceUrl": "https://www.youtube.com/watch?v=zqd7AQTKk6k",
    "videoId": "zqd7AQTKk6k",
    "title": "[LISTENING TOPIK 35] TOPIK 듣기 35회 | 한국어능력시험 듣기 지문 - BÀI NGHE TOPIK II kèm phụ đề",
    "channel": "huongiu",
    "channelId": "UCYOLS4hFNIpCGbwSSzz-WvA",
    "uploadDate": "2019-09-11",
    "identityDecision": "MATCHED_TOPIK_35_LISTENING",
    "verificationTool": "yt-dlp 2026.07.04",
    "verificationMode": "LIVE_METADATA_CHECK_NO_BINARY_REDIRECT_CAPTURED"
  },
  "sourceAudio": {
    "artifactId": "topik35-listening-youtube-original-audio",
    "logicalKey": "practice-seed/topik35-v1/source/audio/beb8c362a7ebe9905467fdfd637aa9db15ebfdd8fb28e22f08ed574f3ef0fcaf.m4a",
    "mediaType": "audio/mp4",
    "formatId": "140",
    "container": "m4a",
    "codec": "aac",
    "sampleRateHz": 44100,
    "channels": 2,
    "durationMs": 3797136,
    "sha256": "beb8c362a7ebe9905467fdfd637aa9db15ebfdd8fb28e22f08ed574f3ef0fcaf",
    "sizeBytes": 61453300,
    "acquisitionMode": "REUSED_EXISTING_BYTE_IDENTICAL_CAPTURE_AFTER_LIVE_IDENTITY_CHECK"
  },
  "derivedProgram": {
    "artifactId": "topik35-listening-program-mp3",
    "logicalKey": "practice-seed/topik35-v1/derived/audio-mp3/0f8f7504849689b15c5dcb5f0892580c81c5285b37ead05058e47a9645a91ee1.mp3",
    "mediaType": "audio/mpeg",
    "container": "mp3",
    "codec": "mp3",
    "sampleRateHz": 44100,
    "channels": 2,
    "bitRateBps": 128002,
    "durationMs": 3797136,
    "sha256": "0f8f7504849689b15c5dcb5f0892580c81c5285b37ead05058e47a9645a91ee1",
    "sizeBytes": 60755426,
    "conversionTool": "ffmpeg 8.1.2 libmp3lame",
    "conversionProfile": "CBR_128K_44100HZ_STEREO_SINGLE_PROGRAM"
  },
  "manualBoundaryQa": {
    "requiredMethod": "HUMAN_AUDITORY_REVIEW_AGAINST_AUTHORITATIVE_TRANSCRIPT",
    "authoritativeTranscriptPackageId": "topik35-v1-listening-transcript-payload-v1",
    "questionPackageId": "topik35-v1-listening-question-payload-v1",
    "captionsAllowedForTimestampInference": false,
    "captionsUsedForTimestampInference": false,
    "automatedSpeechRecognitionUsed": false,
    "signalScanRole": "NON_AUTHORITATIVE_CANDIDATE_DISCOVERY_ONLY",
    "signalScanAcceptedAsBoundaryEvidence": false,
    "auditoryReviewerAvailable": false,
    "blockerCode": "HUMAN_AUDITORY_BOUNDARY_REVIEW_NOT_AVAILABLE_IN_AUTOMATION_ENVIRONMENT",
    "reviewInstructions": "Listen to the original continuous program, match the first and final audible cues to the authoritative Korean transcript, account for repeat playback, and check each neighboring boundary without consulting captions.",
    "groups": [
      {"groupId":"L01_03","questionFrom":1,"questionTo":3,"status":"PENDING_HUMAN_AUDITORY_QA","startMs":null,"endMs":null,"reviewerEvidenceId":null},
      {"groupId":"L04_08","questionFrom":4,"questionTo":8,"status":"PENDING_HUMAN_AUDITORY_QA","startMs":null,"endMs":null,"reviewerEvidenceId":null},
      {"groupId":"L09_12","questionFrom":9,"questionTo":12,"status":"PENDING_HUMAN_AUDITORY_QA","startMs":null,"endMs":null,"reviewerEvidenceId":null},
      {"groupId":"L13_16","questionFrom":13,"questionTo":16,"status":"PENDING_HUMAN_AUDITORY_QA","startMs":null,"endMs":null,"reviewerEvidenceId":null},
      {"groupId":"L17_20","questionFrom":17,"questionTo":20,"status":"PENDING_HUMAN_AUDITORY_QA","startMs":null,"endMs":null,"reviewerEvidenceId":null},
      {"groupId":"L21_22","questionFrom":21,"questionTo":22,"status":"PENDING_HUMAN_AUDITORY_QA","startMs":null,"endMs":null,"reviewerEvidenceId":null},
      {"groupId":"L23_24","questionFrom":23,"questionTo":24,"status":"PENDING_HUMAN_AUDITORY_QA","startMs":null,"endMs":null,"reviewerEvidenceId":null},
      {"groupId":"L25_26","questionFrom":25,"questionTo":26,"status":"PENDING_HUMAN_AUDITORY_QA","startMs":null,"endMs":null,"reviewerEvidenceId":null},
      {"groupId":"L27_28","questionFrom":27,"questionTo":28,"status":"PENDING_HUMAN_AUDITORY_QA","startMs":null,"endMs":null,"reviewerEvidenceId":null},
      {"groupId":"L29_30","questionFrom":29,"questionTo":30,"status":"PENDING_HUMAN_AUDITORY_QA","startMs":null,"endMs":null,"reviewerEvidenceId":null},
      {"groupId":"L31_32","questionFrom":31,"questionTo":32,"status":"PENDING_HUMAN_AUDITORY_QA","startMs":null,"endMs":null,"reviewerEvidenceId":null},
      {"groupId":"L33_34","questionFrom":33,"questionTo":34,"status":"PENDING_HUMAN_AUDITORY_QA","startMs":null,"endMs":null,"reviewerEvidenceId":null},
      {"groupId":"L35_36","questionFrom":35,"questionTo":36,"status":"PENDING_HUMAN_AUDITORY_QA","startMs":null,"endMs":null,"reviewerEvidenceId":null},
      {"groupId":"L37_38","questionFrom":37,"questionTo":38,"status":"PENDING_HUMAN_AUDITORY_QA","startMs":null,"endMs":null,"reviewerEvidenceId":null},
      {"groupId":"L39_40","questionFrom":39,"questionTo":40,"status":"PENDING_HUMAN_AUDITORY_QA","startMs":null,"endMs":null,"reviewerEvidenceId":null},
      {"groupId":"L41_42","questionFrom":41,"questionTo":42,"status":"PENDING_HUMAN_AUDITORY_QA","startMs":null,"endMs":null,"reviewerEvidenceId":null},
      {"groupId":"L43_44","questionFrom":43,"questionTo":44,"status":"PENDING_HUMAN_AUDITORY_QA","startMs":null,"endMs":null,"reviewerEvidenceId":null},
      {"groupId":"L45_46","questionFrom":45,"questionTo":46,"status":"PENDING_HUMAN_AUDITORY_QA","startMs":null,"endMs":null,"reviewerEvidenceId":null},
      {"groupId":"L47_48","questionFrom":47,"questionTo":48,"status":"PENDING_HUMAN_AUDITORY_QA","startMs":null,"endMs":null,"reviewerEvidenceId":null},
      {"groupId":"L49_50","questionFrom":49,"questionTo":50,"status":"PENDING_HUMAN_AUDITORY_QA","startMs":null,"endMs":null,"reviewerEvidenceId":null}
    ]
  },
  "deliveryPolicy": {
    "singleContinuousProgram": true,
    "binaryCommitted": false,
    "directExternalAudioExposedToLearner": false,
    "logicalKeyOnly": true,
    "deliveryResolvedServerSide": true,
    "databaseLoadPerformed": false,
    "objectStoreWritePerformed": false
  },
  "validationSummary": {
    "sourceIdentityVerified": true,
    "sourceDigestVerified": true,
    "derivedDigestVerified": true,
    "sourceAndDerivedDurationMatch": true,
    "groupCount": 20,
    "boundaryReadyGroupCount": 0,
    "loadReady": false
  }
}
